Organisation,Country,Status,Official name (+source),Also known as,Website,Instagram,Est. company size,Primary customers,Year founded,Ownership status,Core model,Geographic scope,Categories,Key partners / customers,Impact metrics,Conf: name,Conf: year,Conf: impact,Verification notes,GitHub slug,Short summary,Logo URL,Featured image URL,SEO description,Primary colour,Tags,Last verified date,Last updated date,Researcher,Source count,Overall confidence,Overall confidence score,REUSE priority rating,SDGs
ASA Beauty,India (Mumbai — Bandra Kurla Complex),Active,asa Beauty,Not publicly available,https://asabeauty.com/,Not publicly available,Not publicly available,"B2C — individual consumers in India, marketed as a premium/luxury clean-beauty brand primarily to women seeking sustainable cosmetics; sold via the company's own D2C website and social channels (Instagram, Facebook, YouTube).",2020,Private; founded by Asha Jindal Khaitan and Sukriti Jindal Khaitan (mother- and daughter-in-law),"asa Beauty sells makeup and skincare-adjacent products direct-to-consumer (primarily online, via its own site and social channels), built around a ""buy once, refill repeatedly"" packaging model: outer cases are designed for reuse while the cosmetic contents are replaced via refill inserts, reducing packaging waste per repurchase. Packaging materials are stated to use aluminium and FSC-certified paper, described by the company as chlorine- and heavy-metal-free, biodegradable, and recyclable. The brand emphasises an inclusive shade range and a ""conscious lifestyle""/""clean awakening"" positioning.",India (Mumbai — Bandra Kurla Complex),Refill Systems,"Not publicly available — no named manufacturing, retail, or NGO partnerships were verified during this research pass.","Not publicly available — no quantified waste-reduction, refill-uptake, or plastic-avoided figures were found on the company website or in press coverage reviewed.",High,High,Low,"- Seed data described focus as ""refillable makeup packaging for all shades"" — confirmed; the brand explicitly markets inclusive shade ranges alongside its refill system. - Founding year (2020) and founders (Asha Jindal Khaitan and Sukriti Jindal Khaitan) were not present in seed data and were added after verification via multiple independent press sources. - A cosmeticsdesign-asia.com article referenced in search results returned an HTTP 410 (Gone) error on direct fetch and could not be used as a primary source;",asa-beauty,"asa Beauty is a Mumbai-headquartered, direct-to-consumer clean beauty brand launched in 2020 by Asha Jindal Khaitan (co-founder of nutraceutical brand Pure Nutrition) and her daughter-in-law Sukriti Jindal Khaitan. The brand positions itself at the intersection of luxury and sustainability, offering natural, vegan, and cruelty-free makeup — lipsticks, lip & cheek tints, highlighters, SPF face sticks, and lip balms — built around a refillable packaging system intended to reduce single-use plastic waste while maintaining a premium",Not publicly available,Not publicly available,"asa Beauty is a Mumbai-headquartered, direct-to-consumer clean beauty brand launched in 2020 by Asha Jindal Khaitan (co-founder of nutraceutical brand Pure Nutrition) and her daughter-in-law Sukriti Jindal Khaitan. The brand",Not publicly available,"consumer-education, refill, waste-reduction",2026-07-17,2026-07-17,AI,6,Medium,77,★★★ Medium,SDG 12: Responsible Consumption and Production; SDG 4: Quality Education
ASD (Ambalaj Sanayicileri Derneği / Packaging Manufacturers' Association),Turkey (Istanbul),Active,Ambalaj Sanayicileri Derneği (ASD) — Packaging Manufacturers' Association,Not publicly available,https://ambalaj.org.tr/en/,Not publicly available,Not publicly available,"Not applicable in a commercial sense — ""customers"" are its 200+ member companies (Turkish packaging manufacturers across paper, glass, metal, flexible, plastic, label, wood, and machinery sub-sectors), plus the broader Turkish packaging industry and policymakers it engages with.",1992,Non-profit industry association (member-based; not a company),"As a non-profit trade association, ASD does not sell products or generate commercial revenue from packaging sales; it is funded through member dues and represents its members' collective interests. Its stated core purposes are to foster growth of the Turkish packaging industry, give the sector a public identity, represent it nationally and internationally, and build scientific, technical, and social cooperation among members. Activities include organising industry events (the Eurasia Packaging Fair Istanbul, the ""Crescents and Stars for Packaging"" design competition,",Turkey (Istanbul),Other,"International trade-body memberships: World Packaging Organisation (WPO), African Packaging Federation (APF), International Association of Packaging Research Institutes (IAPRI), World Design Organization (WDO). No further named corporate or NGO partnerships were independently verified.","Not publicly available — no quantified figures for waste diverted, recycling rates influenced, or deposit-return volumes attributable to ASD's advocacy specifically were found; national DOA system statistics (where they exist) are attributable to the government-led scheme rather than to ASD as an organisation.",High,Medium,Low,"- Seed-data note correctly anticipated that ASD is ""Ambalaj Sanayicileri Derneği"" (Packaging Manufacturers' Association), an industry trade association/non-profit rather than a company — this is confirmed and reflected in Ownership and Primary Category fields. - Founding year (1992) and membership size (200+ companies, from 39 founding members) were not in seed data and were added after verification via a third-party association directory (SEPA), since ASD's own website did not state its founding year in the content retrieved. - The seed",asd,"ASD (Ambalaj Sanayicileri Derneği), known in English as the Packaging Manufacturers' Association, is Turkey's principal packaging industry trade association, founded in 1992 by 39 founding members and now representing over 200 member companies. Based in Istanbul, ASD represents manufacturers across paper/cardboard, glass, metal, flexible packaging, plastic bottles and containers, labels, wooden packaging, and packaging machinery sub-sectors. As confirmed during verification, this is an industry association and non-profit membership body, not a commercial packaging company, consistent",Not publicly available,Not publicly available,"ASD (Ambalaj Sanayicileri Derneği), known in English as the Packaging Manufacturers' Association, is Turkey's principal packaging industry trade association, founded in 1992 by 39 founding members and now representing over",Not publicly available,"consumer-education, waste-reduction",2026-07-17,2026-07-17,AI,4,Medium,63,★★★ Medium,SDG 12: Responsible Consumption and Production; SDG 4: Quality Education
Atelier Rebul,"Turkey (Istanbul) — NOT Belgium; seed data's ""Turkey"" country tag was correct, but the .be website is a Benelux retail/e-commerce arm, not the company's headquarters",Active,Rebul Holding A.Ş. (brand: Atelier Rebul),Not publicly available,https://www.rebulholding.com.tr/ (corporate); https://atelierrebul.be/en (Benelux retail site),Not publicly available,Not publicly available,"Individual retail consumers, purchasing via Atelier Rebul's own stores (Turkey and other markets), e-commerce sites (including the Benelux storefront), and through international retail partners such as Rohto Pharmaceutical's distribution network in Japan.","1895 (original Rebul/Grande Pharmacie Parisienne, Istanbul); modern ""Atelier Rebul"" retail brand relaunched in 2013","Private, family-owned (Müderrisoğlu family, 4th generation); B Corp certified; strategic partnership with Japan's Rohto Pharmaceutical since 2019","Atelier Rebul is a vertically integrated cosmetics and personal-care manufacturer and retailer operating under Rebul Holding, a Turkish family-owned company now in its fourth generation of family leadership. It manufactures liquid soaps, colognes, home fragrance and skincare products at its own facility (reported at 45,750 m², with a monthly capacity of 4.5 million bottles) and sells through owned retail stores, e-commerce (including country-specific storefronts such as the Benelux site), and international distribution partners, including a 2019 partnership with Japan's Rohto","Turkey (Istanbul) — NOT Belgium; seed data's ""Turkey"" country tag was correct, but the .be website is a Benelux retail/e-commerce arm, not the company's headquarters",Cosmetics/Personal Care — Refill Systems,"Rohto Pharmaceutical Co., Ltd. (Japan) — strategic partnership since 2019, enabling Atelier Rebul's entry into the Japanese market in 2021.","Not publicly available. A retailer-sourced product description states refill packs reduce plastic use ""by 78%"" versus a standard bottle, but this figure appears only on third-party retail listings, not on Atelier Rebul's own corporate or product pages, so it is not treated as independently verified here.",High,Medium,Low,"The seed data's country designation (""Turkey"") is confirmed correct by multiple sources (Rebul Holding's own site, Wikipedia, industry press); the seed note's suspicion about the .be domain was reasonable to raise but the resolution is that Atelier Rebul is genuinely Turkish-headquartered (Istanbul) — the .be site is simply a Benelux-market storefront, one of several country-specific sites the brand operates. The ""founding year"" is ambiguous by design: 1895 is the founding of the original Rebul pharmacy; 2013 is when the modern",atelier-rebul,"Atelier Rebul traces its history to 1895, when French pharmacist Jean César Reboul opened the Grande Pharmacie Parisienne on Istanbul's Istiklal Avenue, later run by his Turkish partner Kemal Müderrisoğlu and family. The pharmacy's signature cologne, Rebul Lavanda (1938), became a symbol of Istanbul heritage. The modern ""Atelier Rebul"" retail and lifestyle brand — soaps, colognes, home fragrance and skincare — launched in 2013, built on this 125+ year history, and now operates in roughly",Not publicly available,Not publicly available,"Atelier Rebul traces its history to 1895, when French pharmacist Jean César Reboul opened the Grande Pharmacie Parisienne on Istanbul's Istiklal Avenue, later run by his Turkish partner Kemal Müderrisoğlu",Not publicly available,"consumer-education, refill",2026-07-17,2026-07-17,AI,5,Medium,63,★★ Low,SDG 12: Responsible Consumption and Production; SDG 4: Quality Education
Avo & Co.,Singapore,Active,Avo & Co. Pte. Ltd.,Not publicly available,https://www.avoandco.com/,Not publicly available,Not publicly available,"Individual households in Singapore purchasing via subscription or one-off orders; the company is also referenced by at least one third-party gourmet retailer (Sasha's Fine Foods) as a source/producer profile, suggesting some B2B-adjacent recognition, though Avo & Co.'s core business is direct-to-consumer.",2016/2017 (started late 2016; company entity registered 2017 per Singapore UEN 201730005W),"Private, founder-led (brothers Clement and Cedric)","Avo & Co. operates a direct-to-consumer e-commerce and subscription-box model, sourcing fresh produce from farms and producers and delivering it to households and some businesses across Singapore, typically with next-day delivery for orders placed before a daily cutoff. Customers can choose pre-curated seasonal boxes or build custom orders, with recipe cards included to help reduce food waste at the household level. On packaging, the company's own marketing and customer feedback point to loose or paper-wrapped produce and minimal, largely biodegradable",Singapore,Food & Grocery Delivery — Packaging Reduction,Not publicly available. No named commercial or NGO partnerships were found in verified sources.,"Not publicly available. No quantified figures for packaging avoided, crates reused, or plastic reduction were found in verified public sources.",High,Medium,Low,"The seed data's specific claim of ""returnable crates"" as part of Avo & Co.'s packaging model could not be confirmed from the company's own website (which discusses loose/paper packaging generally but does not describe a crate-return system) or from independent sources found in this research pass; this should be treated as unverified rather than confirmed. Founding year is given as a range (2016 start, 2017 formal registration) because sources differ slightly on exact timing — the company's own site provides",avo-and-co,"Avo & Co. is a Singapore-based online grocery delivery company founded by brothers Clement and Cedric, who were dissatisfied with the quality of fruit and vegetables available through conventional supermarkets. The company sells curated and customisable fresh produce boxes — fruit, vegetables, organic items, microgreens, edible flowers and pantry staples — via subscription (weekly, fortnightly or monthly, with no lock-in) or one-off orders, delivered island-wide in Singapore. It positions itself on produce quality, direct sourcing",Not publicly available,Not publicly available,"Avo & Co. is a Singapore-based online grocery delivery company founded by brothers Clement and Cedric, who were dissatisfied with the quality of fruit and vegetables available through conventional supermarkets.",Not publicly available,waste-reduction,2026-07-17,2026-07-17,AI,4,Medium,63,★★ Low,SDG 12: Responsible Consumption and Production
AVOID,Brazil (São Paulo),Active,AVOID,Not publicly available,https://avoid.net.br/,Not publicly available,Not publicly available,Consumer goods companies and retailers in Brazil seeking to offer refill points for liquid products (B2B); end consumers interact with the refill points at retail but are not AVOID's direct commercial customers.,2020,"Private, venture-backed/founder-led startup (small team, ~2-10 employees per LinkedIn)","AVOID operates a B2B model, working with consumer goods manufacturers and retailers to deploy concentrate-based refill infrastructure rather than selling directly to end consumers. The company supplies or partners on refill machines placed in retail locations, which are stocked with concentrated formula and mix it with water on demand, so retailers can offer refills of cleaning, personal-care or similar liquid products without shipping, storing and disposing of full-volume single-use bottles at every stage of the supply chain. This targets the",Brazil (São Paulo),B2B Refill Infrastructure,"Not publicly available. No specific named retailer or brand partners were confirmed from the company's own site or independent sources in this research pass (the company's ""About Us"" page could not be reliably fetched during this research).","Not publicly available. No quantified metrics (litres refilled, bottles avoided, CO2 reduced) were found in verified public sources.",High,Medium,Low,"The seed data's description (""B2B refill infrastructure and circular design for retailers"") is confirmed as accurate and consistent with verified sources. The company's own website (avoid.net.br) repeatedly returned a connection error during this research pass and could not be fully reviewed; the profile above relies primarily on the company's LinkedIn page, which independently corroborates the country, founding year, and business model. No founding-year discrepancy was found versus the seed data (seed data did not specify a year). --- Confidence —",avoid,"AVOID is a Brazilian greentech startup, headquartered in São Paulo and founded in 2020, that develops refill infrastructure for consumer goods companies. Its core proposition is removing water from liquid product formulas (e.g. cleaning or personal-care products) and combining the concentrate with water directly at in-store refill machines, converting retail locations from conventional points of sale into refill points. The company frames this as a way to cut transportation costs, fuel use and carbon emissions",Not publicly available,Not publicly available,"AVOID is a Brazilian greentech startup, headquartered in São Paulo and founded in 2020, that develops refill infrastructure for consumer goods companies. Its core proposition is removing water from liquid",Not publicly available,"packaging-as-a-service, refill, waste-reduction",2026-07-17,2026-07-17,AI,2,Medium,63,★★★ Medium,SDG 12: Responsible Consumption and Production; SDG 13: Climate Action
Babel Siem Reap,Cambodia (Siem Reap),Active,Babel Siem Reap (Babel Guesthouse / Babel Boutique Hotel),Not publicly available,https://www.babelsiemreap.com/responsible-shopping,Not publicly available,Not publicly available,International and domestic travellers staying at or visiting Babel Siem Reap; broader Siem Reap visitors and residents who use the refill station regardless of accommodation.,"2008 (guesthouse); eco-shop/refill station is a later addition, exact launch date not publicly available","Private, independently owned guesthouse/hospitality business","Babel's core business is guesthouse and boutique-hotel accommodation for travellers in Siem Reap, generating revenue primarily from room bookings. Layered onto this hospitality business is a retail sustainability initiative: guests and visitors can buy a reusable water bottle at Babel's eco-shop and refill it for free with water on-site, then continue refilling it at other participating stations around Siem Reap and, via the regional ""Refill NOT Landfill"" campaign and its associated station map (refillasia.com/map), across several other Southeast Asian countries.",Cambodia (Siem Reap),Hospitality — Refill Systems (in-house initiative),"Refill NOT Landfill / Refill Asia campaign (regional refill-station network, refillasia.com); Friends N Stuff (local employment initiative supplying tote bags sold in the eco-shop).","Not publicly available. No quantified figures (litres refilled, single-use bottles avoided, participants) were found in verified public sources.",High,Medium,Low,"The seed data's characterisation (""guesthouse offering refill containers for hair/body products... not a standalone reuse company"") is confirmed directionally correct: Babel is indeed a guesthouse-embedded initiative, not a standalone company. However, the specific ""hair/body products"" refill detail could not be verified — the confirmed, documented refill offering is a free water-bottle refill station plus a broader eco-shop of locally made, plastic-free goods, not a specific shampoo/soap refill system. This is presented as an open question rather than a confirmed fact.",babel-siem-reap,"Babel Siem Reap is an independently owned eco-focused guesthouse and boutique hotel in Siem Reap, Cambodia, operating since 2008. As part of its sustainability positioning, Babel runs an on-site ""Eco-shop and refill station"" in its lobby, described by the property as the country's first zero-waste shop and refill station of its kind. As noted in the seed data, this is a hotel/guesthouse sustainability initiative embedded within a hospitality business, not a standalone reuse company, and",Not publicly available,Not publicly available,"Babel Siem Reap is an independently owned eco-focused guesthouse and boutique hotel in Siem Reap, Cambodia, operating since 2008. As part of its sustainability positioning, Babel runs an on-site ""Eco-shop",Not publicly available,"consumer-education, refill, waste-reduction",2026-07-17,2026-07-17,AI,3,Medium,63,★★ Low,SDG 12: Responsible Consumption and Production; SDG 4: Quality Education
Babyloop,Portugal,Active,BabyLoop (a project of The Loop Co. / Book in Loop),Not publicly available,https://babyloop.pt/,Not publicly available,Not publicly available,"Families in Portugal buying and selling baby equipment, accessed via the babyloop.pt platform and Continente supermarket drop-off points nationwide.",2019 (launched late January 2019),"Private; developed by Book in Loop (Coimbra-based startup) as a challenge/partnership project with retailer Sonae MC, with TV presenter Carolina Patrocínio as public-facing co-creator","Babyloop operates a consumer-to-consumer resale marketplace with logistics and quality-control support: parents list used baby equipment for sale, Babyloop (via Book in Loop's operations) collects the items — either through free pickup or drop-off at Continente supermarket locations nationwide, leveraging Sonae MC's retail footprint — then sanitises, inspects and professionally photographs each item before listing it for resale to other families. This combination of a retail partner's physical network (Continente) with a specialist reuse-logistics operator (Book in Loop/The Loop Co.)",Portugal,Second-hand Goods / Reuse Platform,Sonae MC / Continente (Portuguese retail group; supermarket network used for drop-off collection points and the originating retail partner); Book in Loop / The Loop Co. (developer and operator of the platform).,"Not publicly available as an independently audited figure. The company/press coverage cites a target of reducing family baby-equipment expenses by up to 80%, but this is presented as a stated goal rather than an independently measured outcome, so no verified quantitative impact metric (e.g. items resold, tonnes diverted) is confirmed here.",High,High,Low,"Seed data (Portugal; babyloop.pt; ""circular second-hand baby products app + drop-off network"") is confirmed accurate. Additional detail found and added: Babyloop originated as a Sonae MC-sponsored challenge developed by Book in Loop/The Loop Co. (not an independent standalone startup), with TV presenter Carolina Patrocínio as public co-creator, and drop-off points specifically at Continente supermarkets. The ""up to 80% expense reduction"" figure is a stated company goal reported in press coverage, not an independently audited outcome, so it is flagged as",babyloop,"Babyloop is a Portuguese circular-economy platform, launched in January 2019, that lets families buy and sell second-hand baby equipment — strollers, cots, bassinets, car seats and related gear. It originated as a challenge set by retailer Sonae MC (parent of Continente supermarkets) and was developed by Book in Loop, a Coimbra startup that had previously applied the same reuse model to second-hand school textbooks, with television presenter Carolina Patrocínio involved as the public face of",Not publicly available,Not publicly available,"Babyloop is a Portuguese circular-economy platform, launched in January 2019, that lets families buy and sell second-hand baby equipment — strollers, cots, bassinets, car seats and related gear. It originated",Not publicly available,"consumer-education, reverse-logistics, take-back, waste-reduction",2026-07-17,2026-07-17,AI,5,Medium,77,★★★ Medium,SDG 12: Responsible Consumption and Production; SDG 4: Quality Education
