Organisation,Country,Status,Official name (+source),Also known as,Website,Instagram,Est. company size,Primary customers,Year founded,Ownership status,Core model,Geographic scope,Categories,Key partners / customers,Impact metrics,Conf: name,Conf: year,Conf: impact,Verification notes,GitHub slug,Short summary,Logo URL,Featured image URL,SEO description,Primary colour,Tags,Last verified date,Last updated date,Researcher,Source count,Overall confidence,Overall confidence score,REUSE priority rating,SDGs
Boomi,China (Shanghai/Beijing),"Apparently inactive/closed — official domain (boomiplatform.com) now redirects to the unrelated Dell Boomi software company, and a SmartShanghai venue listing marks it ""closed""",Boomi (also styled BOOMI),Not publicly available,Not publicly available (former site boomiplatform.com no longer resolves to the company; no working official site found),Not publicly available,Not publicly available,"Chinese consumers, particularly in Shanghai and Beijing, reached primarily through WeChat.",2018,"Private, co-founded by Emmanuel Dean and Miguel Boy","Boomi operated as a curated multi-vendor marketplace connecting Chinese consumers with sustainable, eco-friendly brands, rather than manufacturing its own product range beyond an initial flagship line (bamboo toothbrushes, shampoo bars). Discovery and sales ran chiefly through WeChat, reflecting the platform's China-first, mobile-social-commerce approach. The company positioned itself as helping ""local purpose-driven businesses thrive"" by providing them a shared storefront and audience, while also acting as a content and information hub for sustainable living. It layered a charitable/impact mechanic onto commerce:",China (Shanghai/Beijing),Multi-brand eco-friendly marketplace / B2C e-commerce,- Shanghai Roots & Shoots' Forest Initiative (tree-planting partner in Inner Mongolia),"- ""Over 6,000 trees planted"" toward a stated goal of 9,000 by 2022, per a 2021 beijing-kids.com article citing the company. This figure is dated (2021) and not independently verified by an audited source, and no more recent impact data could be found.",Medium,Medium,Low,"Seed data provided almost no information (""B2C eco marketplace,"" ""Manufacturing collaboration,"" no country/website). Research confirms a real circular/sustainability-adjacent organisation called Boomi (BOOMI) existed, based in Shanghai/Beijing, China, founded 2018 by Emmanuel Dean and Miguel Boy — distinct from the well-known Dell Boomi integration-software company (a much larger, unrelated US enterprise-software firm). However, the ""manufacturing collaboration"" descriptor in the seed data could not be verified; no evidence of a manufacturing/industrial-reuse angle was found. The organisation appears to be inactive/closed as of",boomi,"Boomi (from the Indonesian word ""bumi,"" meaning earth) was a Shanghai-founded sustainability marketplace co-founded in 2018 by Emmanuel Dean and Miguel Boy, operating primarily through WeChat and serving Chinese consumers in cities including Shanghai and Beijing. It began by selling bamboo toothbrushes and grew into a curated platform listing more than 50 local sustainability-focused brands and businesses. As of this research (July 2026), Boomi's former website domain redirects to the unrelated Dell Boomi integration-software company,",Not publicly available,Not publicly available,"Boomi (from the Indonesian word ""bumi,"" meaning earth) was a Shanghai-founded sustainability marketplace co-founded in 2018 by Emmanuel Dean and Miguel Boy, operating primarily through WeChat and serving Chinese consumers",Not publicly available,"consumer-education, waste-reduction",2026-07-17,2026-07-17,AI,4,Low,50,★★ Low,SDG 12: Responsible Consumption and Production; SDG 4: Quality Education
Boox,"United States (Petaluma, California)",Active,Boox,Not publicly available,https://boox.eco/,Not publicly available,Not publicly available,"E-commerce, DTC, beauty, fashion, and apparel brands. Reported customers include Lululemon, REN Clean Skincare, Boyish Jeans, and Ouai.",2020,Private; led by CEO and co-founder Matt Semmelhack,"Boox charges e-commerce and DTC brands a per-shipment service fee (reported at roughly 5–10% above the cost of standard single-use cardboard) for the use of its reusable box and bag system, rather than selling the packaging outright. The reusable containers integrate into a brand's existing fulfillment operations and carry a unique QR code linking to a digital experience and return instructions. After delivery, consumers return the packaging to a network of collection points — primarily Happy Returns' ""Return Bar"" locations","United States (Petaluma, California)",Reusable Packaging / Reverse Logistics (B2B packaging-as-a-service for e-commerce),"- Happy Returns — US return-point network (Return Bars, many located in Staples stores) - InPost — UK parcel-locker return network","- Third-party lifecycle analysis cited by the company found Boox boxes cut environmental impact by 70%+ versus single-use cardboard after 10 shipments (source: Boox/Waste360 coverage; underlying third-party study not independently reviewed). - Return rates vary by brand from roughly 10% to 65%, per FreightWaves reporting (2022) — no more recent or audited figures were found. - No independently audited company-wide impact totals (e.g., total shipments, cumulative waste diverted) were publicly available at time of research.",High,High,Medium,"Seed data (United States, boox.eco, B2B/B2C reusable shipping containers, zero waste e-commerce) is confirmed accurate. Additional verified detail added: founding year 2020, HQ Petaluma CA, CEO/co-founder Matt Semmelhack, and named retail customers (Lululemon, REN Clean Skincare, Boyish Jeans, Ouai) via FreightWaves reporting. One fetched source surfaced marketing copy referencing an ""X3F"" fulfillment partnership and additional named brands (Sephora, H&M, Goop, L'Oréal, Revolve) as clients — this could not be corroborated by other independent sources within the scope of this research",boox,"Boox is a US company, founded in 2020 and headquartered in Petaluma, California, that provides reusable shipping boxes and bags as a replacement for single-use cardboard boxes and poly mailers in e-commerce shipping. Co-founded by CEO Matt Semmelhack, the company sells a packaging-as-a-service model to direct-to-consumer and e-commerce brands: customers receive orders in a durable, reusable Boox container, then return it via a network of drop-off points for cleaning, refurbishment, and reuse on subsequent shipments.",Not publicly available,Not publicly available,"Boox is a US company, founded in 2020 and headquartered in Petaluma, California, that provides reusable shipping boxes and bags as a replacement for single-use cardboard boxes and poly mailers",Not publicly available,"consumer-education, packaging-as-a-service, reusable-packaging, reverse-logistics, take-back",2026-07-17,2026-07-17,AI,5,High,87,★★★★ High,SDG 12: Responsible Consumption and Production; SDG 4: Quality Education
Botánica Granel,Mexico (Mexico City),Active,Botánica Granel,Not publicly available,https://botanicagranel.mx/,Not publicly available,Not publicly available,"Environmentally-conscious consumers in Mexico City, served through two physical retail locations (Condesa and Nápoles) and online/delivery customers nationally within Mexico.",Not publicly available,Private; founded by Silvana Huicochea,"Botánica Granel operates a bulk/refill retail model: customers bring reusable containers to physical stores to purchase unpackaged food staples (grains, pasta, spices, oils) and personal-care/cleaning items (shampoo bars, menstrual cups, toothbrushes, detergents) by weight or volume, avoiding single-use packaging at the point of sale. The company has extended this into e-commerce, offering direct-to-consumer online ordering with delivery (free shipping above a stated order threshold), which for online orders necessarily involves packaged/boxed shipment rather than in-store container refill. The business emphasizes",Mexico (Mexico City),Zero-Waste Bulk Retail (Refill Systems),Not publicly available.,Not publicly available.,High,Low,Low,"Seed data (Mexico, botanicagranel.mx, zero-waste bulk store for food/personal care/cleaning, Condesa store + online) is confirmed accurate. Additional detail added: a second physical location in Nápoles, the founder's name (Silvana Huicochea), the store's positioning as Mexico City's first zero-waste mini-supermarket, and the ~95% local-sourcing claim. Exact founding year could not be verified from available public sources and is recorded as ""Not publicly available."" --- Confidence — Name: High | Founding Year: Low | Impact Data: Low | Last Verified: 2026-07-17",botanica-granel,"Botánica Granel is a Mexico City-based zero-waste retailer described in local press as the city's first zero-waste mini-supermarket, operating physical bulk stores in the Condesa and Nápoles neighbourhoods alongside an e-commerce site. Founded by Silvana Huicochea, who was inspired by Germany's early zero-waste supermarkets, the business allows customers to bring their own containers to purchase more than 400 package-free products, spanning groceries, personal-care, and cleaning items. The company states that roughly 95% of the products",Not publicly available,Not publicly available,"Botánica Granel is a Mexico City-based zero-waste retailer described in local press as the city's first zero-waste mini-supermarket, operating physical bulk stores in the Condesa and Nápoles neighbourhoods alongside an",Not publicly available,"consumer-education, refill, waste-reduction",2026-07-17,2026-07-17,AI,4,Low,53,★★★ Medium,SDG 12: Responsible Consumption and Production; SDG 4: Quality Education
Bottle Factory (보틀팩토리),"South Korea (Seodaemun-gu, Seoul)",Active,Bottle Factory Co. (주식회사 보틀팩토리),Not publicly available,https://www.bottlefactory.co.kr/,Not publicly available,Not publicly available,"Local Seoul consumers and café patrons, particularly in the Seodaemun-gu neighbourhood; broader public engaging with the company's zero-waste content and events (e.g., ""Your Bottle Week"").",2016,"Private social enterprise; CEO Jeong Da-woon (정다운); registered as a ""예비사회적기업"" (accredited/preliminary social enterprise)","Bottle Factory combines a retail café with an experimental refill-retail operation and a social-enterprise content/education practice. Its café (""Bottle Lounge"") generates revenue from food and drink sales while eliminating disposable cups through reusable tumbler lending and price incentives for customers bringing their own containers. Its refill station (""채우장"") sells detergents and cleaning agents — including New Zealand eco-brand Ecostore's laundry products, plus baking soda, sodium percarbonate, and organic fruit soap — dispensed package-free into customer-supplied containers. Beyond direct retail, the","South Korea (Seodaemun-gu, Seoul)",Refill Systems / Reusable Packaging (café + refill retail),- Ecostore (New Zealand eco-brand) — supplier for the detergent refill station,"Not publicly available (no independently verified quantitative impact figures — e.g., volume of disposable cups or packaging avoided — were found in public sources).",High,Medium,Low,"Seed data (South Korea, bottlefactory.co.kr, zero-waste café + eco detergent refill station + bottle club scheme) is confirmed largely accurate — ""Bottle Lounge"" is the café brand and ""채우장"" is the refill-retail concept. The seed data's ""bottle club scheme"" could not be independently corroborated as a currently active named program under that exact term; the company's own materials refer to a ""Bottle Club"" concept but details were not confirmed from primary sources within research scope, so this is flagged rather",bottle-factory,"Bottle Factory is a Seoul-based social enterprise founded in 2016 by CEO Jeong Da-woon, beginning as a reusable-cup café concept (""Bottle Café"") in Yeonhui-dong before establishing its current base in Seodaemun-gu. The organisation operates a ground-floor café known as ""Bottle Lounge,"" which serves no disposable cups (lending tumblers to customers without their own, and discounting drinks for customers who bring bottles from home), alongside a basement ""Bottle Factory"" area that has run a packaging-free detergent",Not publicly available,Not publicly available,"Bottle Factory is a Seoul-based social enterprise founded in 2016 by CEO Jeong Da-woon, beginning as a reusable-cup café concept (""Bottle Café"") in Yeonhui-dong before establishing its current base in",Not publicly available,"consumer-education, refill, reusable-packaging, waste-reduction",2026-07-17,2026-07-17,AI,5,Medium,63,★★★ Medium,SDG 12: Responsible Consumption and Production; SDG 4: Quality Education
Bottle None,"Canada (Kelowna, British Columbia)",Active,Bottle None,Not publicly available,https://bottlenone.ca/,Not publicly available,Not publicly available,"Environmentally-minded consumers in Canada seeking package-reduced personal-care products, sold both direct via bottlenone.ca and through a network of independent Canadian eco/zero-waste retailers.","Not publicly available (company states it has been ""formulating high quality, natural products for over a decade,"" implying a founding prior to 2015, but no specific year was confirmed)",Private,"Bottle None sells solid-format personal-care products (bars rather than liquids in plastic bottles) direct-to-consumer online, reducing packaging at the product level. Its 3D-printed travel cases and soap dishes are manufactured locally in Kelowna using recycled plastic feedstock, and the company operates a closed-loop mechanic: customers can return broken or unwanted cases to be reprocessed into 3D-printing filament and remanufactured into new cases or bottles, rather than being discarded. The company sells direct-to-consumer via its own site and is also stocked","Canada (Kelowna, British Columbia)",Reusable Packaging (solid/bar personal-care products with recycled-material accessories),"Not publicly available as named formal partnerships; the brand is stocked by multiple independent Canadian retailers (e.g., Portia-Ella, Simply Natural Canada, Baltic Marché, COBIA Beauty, Better Clean Canada, All Things Being Eco), but these appear to be retail-stocking relationships rather than confirmed strategic partnerships.",Not publicly available.,High,Low,Low,"Seed data (Canada, bottlenone.ca, zero-waste haircare with 3D-printed recycled material travel cases) is confirmed accurate, with the manufacturing location further pinpointed to Kelowna, BC. Precise founding year could not be verified — the company's own marketing states ""over a decade"" of formulating products, which is not precise enough to confirm a specific year, so this is recorded as ""Not publicly available"" rather than estimated. --- Confidence — Name: High | Founding Year: Low | Impact Data: Low | Last Verified:",bottle-none,"Bottle None is a Canadian personal-care company based in Kelowna, British Columbia, selling solid, package-minimal haircare, skincare, and body-care products (shampoo and conditioner bars, deodorants, facial and body sticks) under the tagline ""more living...less waste."" Its distinguishing reuse feature is a line of travel cases and soap dishes that are 3D-printed in Kelowna from 100% recycled Canadian plastic, paired with a stated end-of-life return program in which worn-out cases can be sent back to the",Not publicly available,Not publicly available,"Bottle None is a Canadian personal-care company based in Kelowna, British Columbia, selling solid, package-minimal haircare, skincare, and body-care products (shampoo and conditioner bars, deodorants, facial and body sticks) under",Not publicly available,"material-recovery, reusable-packaging, take-back, waste-reduction",2026-07-17,2026-07-17,AI,4,Low,53,★★★ Medium,SDG 12: Responsible Consumption and Production
Bout' à Bout',"France (Nantes / Carquefou, Pays de la Loire)",Active,Bout' à Bout',Not publicly available,https://www.boutabout.org/,Not publicly available,Not publicly available,"Nearly 100 food and beverage producers and over 200 distributors (wine shops, grocery stores, retailers) in the Grand Ouest (western France) region, alongside individual consumers who return bottles at collection points.",2016,"Non-profit association (registered as an ""association"" per the Nantes municipal directory)","Bout' à Bout' operates a business-to-business reuse-infrastructure model: it provides diagnostic and consulting services to help producers adopt reusable glass packaging, manages collection logistics from a network of 300+ drop-off points, industrially washes returned bottles and jars at its Carquefou facility, and resells or returns cleaned containers to producers for refilling. Revenue is generated through washing-service fees and logistics/consulting fees charged to participating producers and retailers, alongside grant/institutional support typical of French association-status environmental organisations. The organisation's stated growth target","France (Nantes / Carquefou, Pays de la Loire)",Reverse Logistics / Deposit Return (industrial glass bottle washing and reuse),"- ADEME (French environment and energy management agency) — cited as a supporter - BPI France — cited as a supporter - Citéo — cited as a supporter - Enercoop — renewable-energy supplier for the Carquefou washing facility - Regional retail partners reported in press coverage include Leclerc, Intermarché, and Biocoop","- Washing facility capacity: approximately 60 million bottles/jars per year (~10,000/hour) at the Carquefou plant (company/press reporting, ADEME Infos, 2023). - Network scale: 300+ collection points, ~100 producer partners, 200+ distributor partners, 500+ reusable container references (company website/press, 2023–2024). - Stated 2025 target: 800 producers and 1,000 collection points in the Grand Ouest (company communications; forward-looking target, not a confirmed outcome). - Bottles reported reusable up to approximately 30 times (industry/press reporting) — not independently audited.",High,High,Medium,"Seed data (France, boutabout.org, B2B glass bottle washing and reuse logistics support) is confirmed accurate. Added detail: founding year 2016, Nantes origin with washing facility in Carquefou, non-profit association legal status (confirmed via Nantes Métropole's official association directory), and named institutional/retail partners. One fetched source suggested the organisation might not be association-status but the primary official municipal directory source confirms association status, which is treated as the more authoritative source. --- Confidence — Name: High | Founding Year: High |",bout-a-bout,"Bout' à Bout' is a French non-profit association founded in 2016 in Nantes to rebuild a regional glass-bottle reuse (consigne) system in western France. The organisation operates what is reported to be France's largest glass-container washing facility, a 2,500 m² plant in Carquefou powered by renewable electricity supplied by Enercoop, with capacity to wash around 60 million bottles and jars per year (roughly 10,000 per hour). Bout' à Bout' works with close to 100 beverage",Not publicly available,Not publicly available,Bout' à Bout' is a French non-profit association founded in 2016 in Nantes to rebuild a regional glass-bottle reuse (consigne) system in western France. The organisation operates what is reported,Not publicly available,"consumer-education, deposit-return, industrial-reuse, reusable-packaging, reverse-logistics",2026-07-17,2026-07-17,AI,5,High,87,★★★★ High,SDG 12: Responsible Consumption and Production; SDG 4: Quality Education
Bower Collective,Not publicly available,Active,"Bower Collective Ltd, Companies House no. 11710324 (incorporated 4 December 2018 as Monomer Ventures Ltd; renamed Bower Collective Ltd in August 2019)",Not publicly available,https://bowercollective.com,Not publicly available,Not publicly available,"UK direct-to-consumer households; wholesale/co-operative retail distribution (e.g., Essential Trading Cooperative).",Company founded/conceived summer 2019; incorporated (under a prior name) December 2018; commercially launched to customers January 2020. Sources vary between these three dates — see Verification Notes.,"Private limited company; Certified B Corp (first certified 2021, subsequently recertified); backed by a £2.1M Seed round (2021) led by Oxford Capital and Doehler Ventures","Bower Collective operates a refill-at-home subscription and one-off purchase model: customers buy an initial product in a reusable outer container (e.g. an aluminium or durable bottle), then reorder concentrated refills shipped in lightweight BowerPack pouches, which are lower in plastic mass and shipping volume than repeat purchases of full pre-filled bottles. Over 90% of products are reported as manufactured in the UK, and formulations are marketed as free from parabens, bleach and synthetic fragrances. The company raised a £2.1 million",Not publicly available,Consumer Goods — Refill Systems / Reusable Packaging,"- Oxford Capital and Doehler Ventures — lead investors, 2021 seed round - Essential Trading Cooperative — wholesale/retail distribution partner - B Lab — B Corp certification body","- Company states its community has helped prevent ""over 13 million"" single-use plastic bottles from ending up in landfill (seed-data figure, corroborated by company messaging); more recent company communications cite a higher cumulative figure of ""over 15 million"" single-use plastic bottles prevented — the two figures likely reflect different reporting dates and should be treated as a rising cumulative total rather than a contradiction. Exact publication dates for each figure were not confirmed in verified sources. - Over 7,000 five-star",High,Medium,Medium,"Seed data listed ""Year Established: 2018"" — this is only partially correct. Companies House confirms the legal entity was incorporated 4 December 2018, but under the name ""Monomer Ventures Ltd,"" not ""Bower Collective Ltd"" — the name change to Bower Collective Ltd occurred in August 2019. Independent press coverage additionally states the company was ""founded in summer 2019"" by Torday and Hill and did not commercially launch to customers until January 2020. This is a **correction/clarification** to the seed data:",bower-collective,"Bower Collective is a UK direct-to-consumer company, founded by Nick Torday and Marcus Hill, that supplies natural household and personal-care products (laundry, home cleaning, body and personal care) in reusable, traceable ""BowerPack"" packaging delivered directly to customers' homes. The name references the bowerbird, known for repurposing colourful debris to decorate its nest. Marcus Hill previously founded and sold London Bio Packaging (a biodegradable food-packaging supplier) to Bunzl, while Nick Torday's background is in digital/technology consultancy",Not publicly available,Not publicly available,"Bower Collective is a UK direct-to-consumer company, founded by Nick Torday and Marcus Hill, that supplies natural household and personal-care products (laundry, home cleaning, body and personal care) in reusable,",Not publicly available,"consumer-education, refill, reusable-packaging, reverse-logistics",2026-07-17,2026-07-17,AI,7,Medium,73,★★★★ High,SDG 12: Responsible Consumption and Production; SDG 4: Quality Education; SDG 13: Climate Action
